ID|NOME|DESCRIZIONE
1|GAREN (Giangio)|Un chierico di ******* molto serio e buono dentro che aiuta il gruppo in ogni occasione. Grazie al potere "PiùCuloCheAnima" spesso conclude gli incontri da solo in maniera eroica.
2|HADREN (DeRossa)|Un Tiefling Stregone con la bontà di un cane rabbioso. Fa del coraggio il suo punto di forza eccellendo negli incantesimi "Invisibilità" e "Palla di fuoco". Determinante per danneggiare.
3|JORGEN (Pasqui)|Un Paladino di ****** dell'Impero di ****** che ci ha messo una sessione e mezzo a diventare un paladino decaduto. Molto portato per le combo, entra in depressione se non gli riescono. Di solito termina il combattimento a terra.
4|TARGHAZ (Paolo)|Un (P)Orco Barbaro talmente brutto da convincere gli dei a trasformarlo in un umano ancora più brutto. Devastante in combattimento, ma per sopravvivere deve essere destinatario di tutti gli incantesimi protettivi e curativi.
5|ZAYDAR (Alessio)|Un Guerriero/Stregone dall'allineamento malleabile, si diverte un sacco a lasciare la spada in giro e farla comparire. Intoccabile in combattimento, si deve rassegnare agli incantesimi di livello 0 per fare qualche danno.
